rank,title,summary,tags,interest_count,rating,gender,ages
794,시체기사 군터,"인간과 뱀파이어와의 전쟁은 모두의 예상대로 뱀파이어의 승리로 끝을 맞이하게 된다. 
수세에 몰린 인간은 각고의 노력 끝에 죽지 않는 '시체기사'와 그를 움직일 수 있는 '동력원'제작에 성공하여, 검투사였던 '군터'를 시체기사로 되살리게 되는데.. 
인간과 괴물의 사이, 살아있지만, 죽어있는 존재인 군터는 끝없는 싸움의 마지막, 어떤 선택을 하게 될 것인가.","['크리처', '중세', '모험', '자극적인', '인외존재', '판타지', '액션', '시리어스']",95130,9.95,남성,10대
795,가상&RPG,"""사람은 좀 죽여도 싸우는건 싫어해요."" 게임에서조차 집 바깥을 나가지 않는 '제리'. 전투는 한 번도 안해봤는데, 에픽 무기가 귀속되었다? 가상현실 액션 RPG 모브사가 온라인. 그 고인물들의 군상극.","['최강자전', '2019 최강자전', '고인물', '판타지', '게임판타지']",58665,9.9,남성,10대
796,방구석 재민이,"독특한 캐릭터들의 엉뚱한 일상을 그린 코미디 방구석 재민이. 공감,  게임 요소가 더해져 더욱 흥미롭다.","['개그', '공감', '게임', '생존']",35661,9.95,남성,40대
797,세상이망하지않는다,"평범했던 주인공이 판타지 세계에서 영웅으로 성장하는 세상이망하지않는다의 이야기. 현대, 게임 요소가 더해져 더욱 흥미롭다.","['판타지', '액션', '현대', '게임', '생존']",35648,9.6,남성,10대
798,뱀파이어 가족,"인간들과 떨어져 살아온 뱀파이어.
뱀파이어 가족의 딸 '나탈리아'는 부모님을 설득해 학교에 가게 되고,
그곳에서 첫 번째 친구로 옆자리인 '에반겔로'를 선택한다.

하지만 그 또한 평범한 학생이 아니었는데... 
예측불가 개그 로맨스!","['순정녀', '인외존재', '구원서사', '해외작품', '로맨틱코미디', '개그']",17638,9.96,남성,20대
799,그 해 우리는 - 초여름이 좋아!,"최우식, 김다미 주연의 드라마 <그 해 우리는> 프리퀄 웹툰 대공개!
전교1등과 전교꼴등의 한달살기! 
적당히 놀고 먹다 적당히 잘 죽는게 꿈인 자유영혼 최웅과, 태어나서 1분1초도 적당히 살아본 적 없는 그 지독한 국연수가 만났다. 
청춘다큐 촬영 때문에 한달을 짝으로 붙어살아야 하는 둘, 첫날부터 싸움은 시작된다. 과연 이 다큐 무사히 끝날수 있을까?","['프리퀄', '재회', '로맨스', '청춘로맨스', '학원로맨스', '완결로맨스', '하이틴']",220369,9.97,여성,10대
800,순정말고 순종,"하루에 무려 쓰리잡. 
스물 다섯 지언의 일과 끝에 남는 건 갑질에 시달린 스트레스와 돼지우리같은 집구석 뿐이다. 
그러다 어느날 얻게 된 인형 한 개. 이것만 있으면 대한민국의 탑 배우 남도윤을 가정부로 부려먹을 수있다...?!
2017 최강자전 대상 수상작 <늑대와 빨간모자> 슈안 작가의 차기작!","['로맨스', '연예계', '로맨스코미디', '완결로맨스', '삼각관계']",484076,9.96,여성,10대
801,아일랜드 1부,"악귀들이 가득찬 섬 제주도. 
이를 물리치는 토막살인범 반. 
웹툰으로 돌아온 퇴마만화의 전설 <아일랜드 1부>","['슈퍼스트링', '스릴러', '완결스릴러', '드라마&영화 원작웹툰']",127164,9.96,남성,20대
802,라이징패스트볼,"고교야구! 야구소년!
불꽃같은 그들의 이야기!","['스포츠성장', '완결스포츠', '스포츠', '야구']",139488,9.51,남성,20대
803,미운백조새끼,"미운백조새끼의 주인공은 평범한 일상 속에서 예상치 못한 사건에 휘말리게 된다. 공감, 가족 요소가 더해져 더욱 흥미롭다.","['드라마', '공감', '가족', '힐링']",17672,9.8,여성,20대
804,너와 XX,"데이팅 앱? 그거 그냥 가볍게 즐기는 앱 아냐?
어느새 이성을 만나는데 대중화되어버린 데이팅 앱.
친구 사이인 원아와 지희도 우연히 XX라는 데이팅 앱을 사용하게 된다
데이팅 앱으로 다양한 남자들을 만나게 되는 지희와 남사친과 XX로 만난 남자 사이에서 고민하는 원아
과연 그녀들은 진실한 사랑을 찾을 수 있을까?","['하이퍼리얼리즘', '리얼로맨스', '로맨스']",23936,9.88,여성,10대
805,괴물 난신,"괴물 난신은 동양의 전통적인 무협 세계관을 현대적으로 재해석한 작품이다. 오컬트, 동양풍판타지 요소가 더해져 더욱 흥미롭다.","['무협/사극', '액션', '오컬트', '동양풍판타지', '판무']",346969,9.9,남성,10대
806,각자의 디데이,"헤어졌지만 헤어지지 않은 사이
솔직하지 못한 우리들 어떻게 될까요?","['완결로맨스', '학원로맨스', '로맨스']",189354,9.97,여성,10대
807,상봉 서고에서 만나요!,"죽은 이들 생전의 이야기를 보관하는 저승 서고,
그곳에서 보고 싶은 이의 책을 찾으면, 
죽은 이라 할지라도 다시 만날 수가 있다고 하여
'상봉 서고' 라고도 불린다.
우연히 서고에 들어선 수찬은 사서 남궁영을 만나고
영이는 수찬에게 자신의 책을 만드는 걸 도와준다면 엄마의 책을 찾아주겠다고 하는데...
수찬은 서고에서 엄마를 다시 만날 수 있을까?
2022 최강자전 수상작!","['우정', '2022 최강자전', '가족', '감성적인', '드라마', '성장물', '판타지']",23209,9.95,남성,20대
808,칼끝에 입술,"제국의 미친개, 역대 최강의 기사 아르네. 
그녀는 부모님의 성화에 어쩔 수 없이 결혼을 하게 된다.
""남편이 맘에 안 들면 죽이고 돌아와야지.""
하지만 누구도 남편이 이렇게 잘생겼다고 말 안 해줬잖아?
“당신이 유리 같아서 깨질까 봐 불안해.”
게다가 남편이 나를 연약한 도자기처럼 대하는데?
전혀 약하지 않은 아르네와, 전전긍긍 집착남편 카시안.
오해와 오해가 겹치는 아슬아슬 착각 로맨스!","['로맨스', '결혼생활', '서양', '능력녀', '집착남', '공식미남', '공식미녀', '왕족/귀족']",208380,9.94,여성,10대
809,계약 결혼의 말로,"운명적인 만남으로 시작된 두 사람의 달콤한 사랑 이야기 계약 결혼의 말로. 서양,  마법 요소가 더해져 더욱 흥미롭다.","['로맨스', '판타지', '개그', '서양', '마법']",23978,9.93,여성,10대
810,1학년 9반,"1학년 9반 친구들은 부푼 설레임을 안고 수학여행을 떠나지만. 일진들의 장난으로 반 전체가 무인도에 표류하게된다.
서로에 대한 불신으로 더 이상 친구가 아닌 적이 되어 버린 1학년 9반 친구들... 과연 그들은 무사히 탈출 할 수 있을까?","['서스펜스', '스릴러', '완결스릴러']",59481,9.7,남성,20대
811,공포단편선X,"작가 ‘김대일’의 섬뜩한 연출력이 만든 <공포단편선 X>! 
이색적인 공포 이야기들을 단편으로 다양하게 보여준다. 끝나는 순간까지 결과를 예측할 수 없는 공포가 다가온다.","['스릴러', '완결스릴러']",71148,9.75,남성,20대
812,반려짐승,"개라면 종을 가리지 않고 싫어하는 사람인 '안재필'.
애견인인 상사와의 마찰로 인해 다니던 직장을 그만두게 된 그는 작은 타투샵을 차린다.
그렇게 타투이스트로 살아가던 어느 날, 
재필은 집 근처에서 죽어가는 강아지 한마리를 발견하는데...
그 곁을 무심히 지나치려는 찰나, 그는 불현듯 빗속에서 죽어가던 자신의
어릴 적 모습을 떠올리게 된다.
개를 싫어하는 마음과 동정심이 교차하는 가운데 재필이 내린 선택은..?","['동물', '무해한', '감성적인', '드라마', '성장물', '성장드라마', '일상', '힐링']",36119,9.95,여성,30대
813,3분의 2가 없어도,"3분의 2가 없어도은 설렘과 감동이 가득한 로맨틱한 사랑을 그린다. 결혼생활, 명랑녀 요소가 더해져 더욱 흥미롭다.","['로맨스', '결혼생활', '명랑녀', '다정남']",59484,9.8,여성,20대
814,악취,"며칠 전부터 아랫집에서 썩은 내가 나기 시작했다. 
냄새가 나고 얼마 뒤, 친구가 사라졌다. 그리고 아랫집 누나까지. 그 다음은...? 
사라진 사람들, 그리고 그들을 찾는 사람들의 이야기!","['최강자전', '2018 최강자전', '스릴러', '완결스릴러']",109707,9.92,남성,20대
815,나처럼 던져봐,"불꽃처럼 다시 시작되는 야구인생!

당신처럼 던지는 한 남자의 이야기!

본 컨텐츠는 장이 작가가 전하는 한화이글스의 브랜드웹툰입니다.","['완결스포츠', '스포츠', '야구', '완결무료']",53146,9.96,남성,20대
816,미래의 골동품 가게,"숨막히는 긴장감과 미스터리로 가득한 미래의 골동품 가게의 세계. 오컬트판타지,  시리어스 요소가 더해져 더욱 흥미롭다.","['스릴러', '오컬트판타지', '시리어스', '현대']",341892,9.98,여성,30대
817,쎄쎄쎄,"[장난스럽지만 사랑스러운 첫 연애]

윤고명과 김민한은 연인이다. 
누가 먼저 좋아해서 이어진 관계도 아니고, 서로에게 그다지 관심도 없어 보이기도 한다. 
하지만, 조금의 호감과 적절한 무관심 덕에 둘의 연애는 분명히 진행 중이다. 장난스럽고 때로는 사랑스러운 연애 만화.","['로맨스', '하이퍼리얼리즘', '학원로맨스', '완결로맨스', '하이틴']",29343,9.93,여성,10대
818,강한 누나,"하나 뿐인 가족, 동생 '강한'을 책임지기 위해 열심히 일하는 가장이자 누나 '강하니', 어느 날 동생의 학교에서 장기무단 결석으로 퇴학 조치 통보를 받게 된다. 
하지만 과도한 훈육으로 동생은 집을 나가버리고, 결국 퇴학을 면하기 위해 어쩔 수 없이 누나가 동생으로 변장하고 등교하게 되는데..","['철벽녀', '사이다', '집착남', '드라마', '개그', '액션', '무심녀', '참교육']",89292,9.89,남성,20대
819,착한 여자 안선해,"사람들이 생각하는 ‘착하다’는 무슨 뜻일까? 
선해는 착하다는 말을 싫어한다. 어린 시절부터 사람들이 이유 없이 선해가 착하다고 말해왔기 때문이다. 착한 일을 한 적도 없는데 왜 그렇게 말하는 건지. 
사람들의 세뇌 덕분에 선해는 직업도 사회복지사로 정했다. 눈을 뜨고 보니 어느새 그렇게 돼 있었다. 
그러다 보니 착하다는 그 지긋지긋한 말을 회사에서도 수없이 듣곤 한다. 착하다는 말로 선해를 이용하는 사람들. 
하지만 사실 선해는 부정하고 싶었을 뿐, 사람들이 말하는 착함의 정의를 알고 있다. 
착하다는 말은 ㅂㅅ호구새끼를 말한다는 것을.","['평범녀', '소심녀', '무심남', '현대', '감성적인', '드라마', '청춘', '공감', '오피스']",27911,9.92,여성,30대
820,무림서부,"무림의 고수들이 펼치는 치열한 싸움을 그린 무림서부. 세계관,  힘숨찐 요소가 더해져 더욱 흥미롭다.","['무협/사극', '세계관', '힘숨찐', '판무']",89374,9.95,남성,30대
821,좀비X슬래셔,"흔한 설정이다. 좀비 사태가 발생했다.
사람들은 부산에 안전지대를 만들었으나, 한정된 공간과 넘치는 사람들로 집값은 천정부지로 치솟는다.
(여전히) 내 집 마련은 꿈도 못 꿀 시대.

이 이야기의 주인공도 집이 없다. 이 글을 보고 있는 당신과 마찬가지로.
좀비를 사냥하여 돈을 버는 직업, 좀비 슬래셔. 내집마련을 위해 그는 최전선에 뛰어들기로 한다.","['좀비', '액션아포칼립스', '아포칼립스', '완결액션', '인외존재', '감염', '먼치킨', '액션']",74887,9.78,남성,20대
822,롤랑롤랑,"코기 왕자 롤랑과 마녀 루이사의 모험 이야기.
베일에 숨겨져 있던 대사제의 과거와 교단의 비밀이 드디어 밝혀지는데...","['동물', '인외존재', '성장드라마', '완결판타지', '판타지']",143233,9.98,남성,10대
823,멍멍냠냠,"할머니께서 돌아가신 후 오롯이 혼자가 된 재희. 
세간살이를 줄여 변두리의 빌라로 이사하던 날, 
꾀죄죄한 몰골의 불청객, 아니 불청'견'이 찾아왔다. 
한없이 인간적인 개 홍시와 낙엽마냥 건조한 인간 재희, 
항상 시끌벅적한 준마빌라 사람들의 복작복작 한지붕 다가족 이야기!","['일상개그힐링', '완결감성', '동물', '음식&요리', '감성적인', '공감', '감성', '일상']",15441,9.98,여성,30대
824,어린 상사,"지루한 연애 끝에 결혼을 앞둔 평범한 직장인, 강시현. 
그녀 앞에 어릴 적 자신이 돌봤던 아이, 윤태하가 나타났다.
새로 부임한 본부장, 그러니까 시현의 상사로. 

“너 나한테 이러면 안 돼. 세상에 마지막 남은 남자가 너라도 우린 안 된다고!” 
그토록 귀여웠던 어린아이가, 어느덧 남자의 눈빛으로 그녀를 바라보며 말한다. 

""그 결혼, 나랑 해.""","['소설원작', '리얼로맨스', '로맨스', '오피스로맨스', '완결로맨스', '오피스']",107731,9.87,여성,10대
825,"안녕, 나의 수집","슈퍼 '맥시멀리스트'였던 내가 어느 날 '미니멀리즘'에 눈을 떴다?! 
이것저것 사 모으는 걸 좋아했던 맥시멀리스트 '무주'.
어느 날 포화상태가 된 방을 보고 '이대론 안되겠다'라는 생각이 들었다. 
저마다 다양한 사연을 갖고 있는 물건들을 비워내며 미니멀리스트가 되려 하는 무주와 물건의 이야기!","['완결일상', '무해한', '일상']",74790,9.95,여성,10대
826,잡아먹어서 안달,"운명적인 만남으로 시작된 두 사람의 달콤한 사랑 이야기 잡아먹어서 안달. 자극적인, 혐관 요소가 더해져 더욱 흥미롭다.","['로맨스', '드라마', '자극적인', '혐관', '할리퀸']",339234,9.9,여성,30대
827,서북의 저승사자,"""넌 내가 데려간다"" 
저승사자와의 달콤 살벌한 고교 생활!","['완결판타지', '판타지']",191530,9.98,남성,10대
828,2015 우주특집 단편,"광활한 우주를 배경으로 펼쳐지는 무한한 상상력
네이버 웹툰 작가들이 선보이는 스페이스 오페라","['완결판타지', '판타지', '완결무료']",40414,9.54,남성,10대
829,3단합체김창남,"삼봉이발소의 하일권이 돌아왔다.
본격 SF청춘만화","['완결드라마', '드라마']",84084,9.94,여성,30대
830,오늘부터 0촌!,"10년차 커플을 그만두고 1년차 신혼부부가 된 한 커플이 있다.
진짜 오타쿠인 아내 ‘히디’와 오타쿠 서당개 10년차인 남편 ‘진돌’
뉴튜버 하기 전, 같이 웹툰 작업을 하기 전의 풋풋했던 그 때의 이야기.","['완결일상', '무해한', '일상', '개그', '가벼운']",66247,9.98,여성,10대
831,나만 보는 탑 공략집,"평범했던 주인공이 판타지 세계에서 영웅으로 성장하는 나만 보는 탑 공략집의 이야기. 게임, 상태창 요소가 더해져 더욱 흥미롭다.","['판타지', '액션', '게임', '상태창', '배틀']",84266,9.8,남성,10대
832,간택주의보,"벗을 위해 변장 후 기방에 들어간 소진.
우연히 헐벗은 사내, 이헌을 마주하게 되는데, 낯설지 않은 그는 바로 1년 전 소진이 구해준 사내.
왕세자 이헌은 잃어버린 기억을 되찾기 위해 소진을 유혹하기 시작하는데, 벗을 찾으러 세자빈 간택을 이용해 궐에 잠입하려는 소진.
완벽한 계획에 변수가 생기고 간택에서 떨어져야만 하는 소진에게 ‘로맨스주의보’가 내려졌다!","['소설원작', '로맨스', '완결로맨스']",81132,9.92,여성,10대
833,하우스키퍼,"'A.I가 인간에게 반역하는 것은 인간을 위해서이다.'
A.I 혁명이 일어난 세계에서 사상 최악의 바이러스가 창궐하고 하스티의 주인 네빌은 좀비화가 된다.
세계연합정부는 환자들의 치료를 포기하고 감염확산을 막기 위해 좀비 학살 정책을 벌인다.
인간이 인간을 포기한 최악의 상황에서도 하스티는 주인인 네빌을 포기할 수 없었다.
좀비가 된 주인을 지키기 위한 A.I들의 처절한 사투가 시작된다.","['크리처', 'SF액션', '액션', 'sf', '아포칼립스', '슈퍼스트링', '판타지', '시리어스']",197387,9.96,남성,20대
834,옆집 동생이 뱀파이어면 어떡하죠?!,"‘뱀파이어가 친근한 존재면 좋겠어!’
우리는 이를 염원하며 글을 쓰지만 잘 풀리지 않는다.그러던 어느 날,민의와 스킨십을 하고 나서 어째 글이 술술 잘 풀리는데…?!
이웃집 형과 동생의 알콩달콩 some 있는 스토리!","['완결로맨스', '로맨스']",137987,9.96,여성,10대
835,고교흥신소,"뭐 하나 빠지는 것 없는 고등학생 한유진, 학교에서는 조용하게 지내는 학생이지만
밖에서는 흥신소를 운영하는 사장으로써, 친구들과 함께 뒷세계의 일들을 해결해 나간다!","['완결드라마', '완결무료', '드라마']",16812,9.04,여성,30대
836,라면 대통령,"연애 5주년, 특별한 기념일에 라면을 끓여줬다가 보기 좋게 차인 ‘구공탄’.
할 줄 아는 건 라면 끓이는 게 전부였던 백수 공탄은 전 여친 ‘묵은지’가 기획한 ‘라면 대통령’ 서바이벌 오디션에 도전한다. 

라면을 통해 진정한 사랑을 찾아가는 네 남녀의 연애 레시피.","['완결드라마', '드라마']",36049,9.86,여성,30대
837,벽간소음,"기회는 멀고, 가난은 곁에 있다.
편의점 알바를 하며 여성 전용 고시원에 살고 있는 대학생, 은선혜.

어느 날부터 옆 방에서 남자 목소리가 들리기 시작했다.
여성 전용 고시원에서 벽 너머로 자꾸 들리는 남자 목소리에 
짜증이 난 선혜는 옆 방에 직접 찾아갔지만, 
그 방은 몇년 째 쓰지 않는 방이라는 것을 알고 당황한다.

그럼 내가 들었던 벽 너머의 소리는 뭐였을까...?
옆 방의 비밀을 알게 된 순간, 
평범했던 그녀의 인생이 크게 흔들리기 시작한다!","['스릴러', '두뇌싸움']",36984,9.92,남성,20대
838,2D남친 별책부록,"인기 로맨스 웹툰 남자주인공의 심쿵 컷 대방출!
미공개 에피소드를 지금 만나보세요","['완결무료', '로맨스', '완결로맨스']",82294,9.82,여성,10대
839,세상은 돈과 권력,"재벌 3세가 일반 고등학교에 들어오면서, 선생들과 학생들은 거대 자본에 굴복해 권력을 차지하기 위한 '두뇌싸움'이 난무하는 학교로 바뀐다. 이 학교의 법칙을 부수기 위해 천재 '단건우'가 전학온다.","['완결드라마', '블루스트링', '드라마', '인생역전', '재벌', '머니게임']",428369,9.88,여성,30대
840,배드 블러드,"평범했던 주인공이 판타지 세계에서 영웅으로 성장하는 배드 블러드의 이야기. 배틀,  소년물 요소가 더해져 더욱 흥미롭다.","['판타지', '액션', '배틀', '소년물', '전쟁']",82298,9.96,남성,40대
841,요리GO,"요리고등학교 졸업 후 산에서 수련을 마친 한별.
특급 호텔 레스토랑에 인턴으로 취업하게 되지만
엄하기로 소문난 호텔 주방에서 다양한 사건들에 휘말리게 되는데...
과연 요리천재 한별은 이 어려움을 어떻게 헤쳐나갈 수 있을까?","['완결드라마', '소년왕도물', '직업드라마', '음식&요리', '드라마']",263231,9.95,여성,30대
842,남사친의 법칙,"남몰래 '재이'를 짝사랑해온 '지운'. 재이가 자신에게 고백할 줄 알았던 지운은, 재이의 짝사랑 상대가 다른 사람이라는 사실을 알고는 정신이 아득해진다. 
짝사랑이 허무하게 끝났다고 생각함과 동시에, 재이가 자신의 짝사랑 상대를 '서현'이라고 착각하고 있다는 걸 알게 된다. 
그저 재이의 키 크고 덩치 큰 친구 중 하나일 뿐인, 말 그대로 남자인 사람 친구일 뿐인 서현과 자신을 이어주려는 재이의 행동에 해탈하고 마는데... 
좌충우돌 학원 로맨스!","['다정남', '짝사랑남', '리얼로맨스', '로맨스', '청춘', '계약연애', '짝사랑녀', '짝사랑']",265386,9.95,여성,10대
843,메달 브레이커,"본 컨텐츠는 KT의 브랜드 웹툰으로 조용석 작가가 전하는 메달브레이커 입니다.

의문의 전학생 진종오, 그리고 서서히 밝혀지는 그의 정체! 

알고보니 그는 올림픽 메달을 따기 위해 특수 훈련된 비밀 조직의 일원이라는데.. 

많은 기대 부탁 드립니다.","['스포츠', '완결스포츠', '완결무료']",35388,9.94,남성,20대
844,매지컬 급식:암살법사,"온갖 ‘빌런’들로 가득한 현대사회, 이 어지러운 세상에 정의를 실현하고자 신이 강림했다.
그의 정의를 실현 할 용사는 바로… 마법소녀??
어쨌든 빌런을 퇴치하고자 마법소녀가 나타났다! 성능 확실한 마법소녀의 빌런 퇴치기!","['이능력배틀물', '완결판타지', '판타지', '학원물', '완결무료']",36017,9.94,남성,10대
845,"곱게 키웠더니, 짐승","반쪽짜리 황녀 블론디나. 외로운 그녀의 유일한 친구는 귀여운 고양이...가 아니라, 만인이 두려워하는 흑표범 신수 에이몬!
자신과 닮아 외로워 보이는 신수님을 치료해주고, 간식 주고, 곱게 키워줬더니...
""그렇게 도망가면 사냥하고 싶어져."" 오히려 곱게 잡아먹히게 생겼다?!","['소설원작', '짐승남', '이세계', '로맨스', '낮져밤이', '직진남', '인외존재', '구원서사']",452768,9.96,여성,10대
846,"아니, 저는 황녀님만 꼬셨다니까요?","과로사로 쓰러진 후, 학대받고 냉대받는 시한부 엑스트라 몸에 빙의했다.
우리 귀여운 여주인공, 황녀님을 꼬서서 둥가둥가 행복하게 살기 위해 모든 것을 준비했는데
“새아가에게 그 정도는 줘야지.""
“누나. 저 인간들 좀 때려도 돼요?""
“부인께서 너무 귀여워서 그랬습니다.”
왜 다른 분들은 꼬실 생각이 없었는데 저에게 넘어온 거죠?!","['로맨스', '서양', '무해한', '신화', '가족', '능력녀', '마법', '왕족/귀족', '가벼운']",78245,9.95,여성,10대
847,자매전쟁,"단 하나로 인정받고 싶었던 두 소녀, 예술고등학교 1등과 2등을 앞다투는 '원리온'과 '추해라'.
'진짜'가 되기 위한 천재 소녀들의 치명적인 전쟁이 시작된다.","['순정남', '가족', '자극적인', '능력녀', '드라마', '악역이주인공', '빌런', '고자극드라마']",339869,9.92,여성,30대
848,시월드 판타지,"첫 눈에 반한 남편이 악마라니....
그리고 시어머니는 마왕?! ㄴ(°0°)ㄱ
용사 조라세, 시댁의 '찐' 마왕과 목숨을 건(?) 대결이 시작된다.","['완결판타지', '판타지', '4차원']",127800,9.92,남성,10대
849,별을 삼킨 너에게,"어둠 같은 현실 속에서도 우리가 빛나는 이유는, 
저마다의 별을 품고 있어서가 아닐까?
별처럼 빛나는 우리들의 성장, 그리고 로맨스.
네이버웹툰 최강자전 19년 대표작.","['친구>연인', '로맨스', '최강자전', '연예계', '2019 최강자전', '연상연하', '아이돌']",414231,9.93,여성,10대
850,불행은 늘 곁에 있다,"운명적인 만남으로 시작된 두 사람의 달콤한 사랑 이야기 불행은 늘 곁에 있다. 현대, 동양 요소가 더해져 더욱 흥미롭다.","['로맨스', '드라마', '현대', '동양', '신화']",127812,9.9,여성,30대
851,탑코너,"소설가의 꿈을 가진 수학 천재소년 안시준. 
우연히 광진고 축구부의 유망주 허도형과 만나게 된다. 

뜻밖의 사건으로 시준에게 잠재된 축구 재능을 발견한 도형.
팀을 구하기 위해 시준에게 은밀한 거래를 제안하지만..

"".. 난 축구는 한 번도 해본 적 없는데..?""

과연 시준은 위기에 빠진 광진고 축구부의
구세주가 될 수 있을까?

꿈을 좇는 소년들의 축구드라마. 수학 천재의 킥오프가 시작된다!","['열혈', '우정', '스포츠', '스포츠성장', '청춘', '성장물', '학원물', '축구']",157372,9.57,남성,20대
852,썸남,"옆방에 사는 어색한 두 남자들에 대한 고찰. 

2014 대학만화 최강자전 수상작!","['최강자전', '2014 최강자전', '드라마']",164147,9.97,여성,30대
853,쇼윈도 탈출,"완벽한 비주얼에 스윗한 팬서비스로 사랑받는 아이돌 '윤재'.
운 좋게 인기 예능에 섭외되며 개인 활동까지 성공가도를 달리나 했는데, 그 기쁨도 잠시.
잊고 살았던 그의 과거가 목을 조여온다. 과연 윤재는 빛나는 연예인의 삶을 지켜낼 수 있을까?
2022 지상최대공모전 1기 최우수상 수상작.","['2022 지상최대공모전', '드라마']",41769,9.89,여성,30대
854,최강남자,"최강남자은 삶의 무게와 희망 사이에서 고민하는 인물들의 이야기를 그린다. 오피스, 청춘 요소가 더해져 더욱 흥미롭다.","['드라마', '오피스', '청춘', '능력남']",337425,9.9,남성,30대
855,싸귀2 : 퇴마록,영혼들과 대화하는 소년 소녀의 두번째 이야기!,"['완결판타지', '판타지', '완결무료']",241980,9.69,남성,10대
