rank,title,summary,tags,interest_count,rating,gender,ages
1549,오삼이 재생 일기,"서로 다른 환경의 두 사람이 만나 진정한 사랑을 찾아가는 오삼이 재생 일기. 청춘,  러블리 요소가 더해져 더욱 흥미롭다.","['로맨스', '드라마', '청춘', '러블리', '재벌']",173159,9.92,여성,30대
1550,트롤트랩,"트롤을 잡아, 인류를 지켜라!
정체불명 헌터 하태와 알바헌터 지현의 통쾌한 판타지 액션","['완결판타지', '소년왕도물', '판타지']",163211,9.85,남성,10대
1551,내 남편의 애인에게,"운명적인 만남으로 시작된 두 사람의 달콤한 사랑 이야기 내 남편의 애인에게. 자극적인, 유혹남 요소가 더해져 더욱 흥미롭다.","['로맨스', '판타지', '자극적인', '유혹남', '복수극']",163307,9.9,여성,10대
1552,모태솔로수용소,"모태솔로가 중범죄자 취급받는 미래의 한국
엉겁결에 잡혀들어온 독고남과 수감자들의 우여곡절 코믹 탈주기","['완결드라마', '드라마']",242546,9.92,여성,30대
1553,예뻐요,"예뻐요은 설렘과 감동이 가득한 로맨틱한 사랑을 그린다. 햇살남, 공식미녀 요소가 더해져 더욱 흥미롭다.","['로맨스', '햇살남', '공식미녀', '아이돌']",49082,9.7,여성,10대
1554,보이지 않는 사랑,"운명적인 만남으로 시작된 두 사람의 달콤한 사랑 이야기 보이지 않는 사랑. 리얼로맨스,  혐관 요소가 더해져 더욱 흥미롭다.","['로맨스', '리얼로맨스', '혐관']",30371,9.4,여성,10대
1555,진진돌이 제로,"짐승 특수부대의 화려한 총격전!

또 다른 버전으로 만나는 진진돌이.","['완결액션', '액션', '완결무료']",49562,9.92,남성,20대
1556,시간의 섬,"신비한 섬, 각기 다른 14명의 인물들이 들려주는 따뜻한 이야기",['판타지'],53493,9.8,남성,10대
1557,취업의소리,"조석,wony(박종원) 2인의 작가들이 펼치는,팍팍!! 막힘 없이 뚫리는 취업이야기.

웃음은 크게~ 청년 취업 고민은 쏘옥","['개그', '완결무료', '완결개그']",538,9.17,남성,20대
1558,일진만화에서 살아남기,"1위 일진 웹툰 작가 노철민, 자신이 만든 웹툰 속에 갇히다!
그것도 세계관 최약체 캐릭터로! 세계관 최강자 ‘주인공’의 몸속엔 그의 탈주 어시스트?!
성격 파탄 일진 웹툰 작가와 그의 탈주 어시스트, 이 엉망진창 콤비는 험악한 일진만화 세계에서 살아남을 수 있을까?","['완결액션', '액션', '완결무료']",10384,9.51,남성,20대
1559,두꺼비집,"‘두껍아 두껍아 헌집줄게 새집다오’
보육원을 나와 잘 곳을 찾아 헤매던 아이들은 산 속에서 한 비어 있는 집을 발견한다.
아이들은 이 집을 아지트 삼으려 하다가, 집에 갇히고 마는데..
아이들은 이 집에서 무사히 나갈 수 있을까?
이 집에선 대체 무슨 일이 있었던 걸까?","['오컬트', '자극적인', '가족', '서스펜스', '스릴러', '고자극스릴러', '괴담', '시리어스']",30996,9.53,남성,30대
1560,리즌,"믿는 자들과 믿지 않는 자들의
생존을 위한 처절한 몸부림.","['스릴러', '완결스릴러']",69849,9.79,남성,20대
1561,기사도,"물러설 곳 없는 두 남자의 싸움이 시작된다!
쫓고 쫓기는 그들의 스릴 넘치는 이야기, '기사도'","['완결액션', '액션']",119199,9.88,남성,20대
1562,미숙한 친구는 G구인,또띠또띠 뀌꼬르떼 레마르장의 완전 신나는 4차원 지구생활기!,"['개그', '완결개그']",53193,9.94,남성,20대
1563,도자기,어렵다고 느끼는 우리의 문화재를 현대적인 감수성으로 술술 풀어낸 호연 작가님의 세계!오늘의 도자기는 무엇을 품고 있을지 함께 상상해보세요.,"['완결드라마', '완결무료', '드라마']",6058,9.75,여성,30대
1564,엘프,"유원지 관리인 태인에게 자신을 '엘프'라 하는 이상한 손님 제솔이 찾아온다. 
그녀는 아버지의 유품을 달라고 하면서 그의 목걸이를 훔쳐 간다. 
그때, 태인을 납치(?) 하는 정체불명의 사람들. 
그들은 태인이 우리나라의 소수민족 '엘프'이며, 
'엘프' 중에서도 신처럼 모셔지는 강산의 후예라며 
태인에게 '엘프'가 이주할 수 있게 도와달라 부탁하는데...","['세계관', '판타지', '완결판타지']",23692,9.97,남성,10대
1565,에이전트,"""놀러 가네"" ""꿀 빠네!"" 늘 무시 당하고 억압 당하는 사회 복무 요원들.
하지만 사람들은 모를 것이다. 힘을 숨긴 채 대한민국의 안보를 책임지고 있는 비밀 특수부대, 사회 복무 요원들을...","['완결액션', '액션']",93094,9.45,남성,20대
1566,손 안의 안단테,"""나는 살아갈 것이다. 
안단테의 리듬을 한, 이 사람의 심장으로."" 
열두 살의 나이에 확장성 심근증을 진단받은 다울. 
그로부터 4년 후, 다울에게 새 심장을 줄 공여자가 나타난다. 
죽음의 문턱에서 삶을 되돌려 받은 다울. 
상실 끝에 삶의 궤도에서 멀어져 가는 연조. 
살아 있는 두 사람을 위로하는 죽은 피아니스트의 이야기.","['완결드라마', '음악', '드라마', '성장드라마', '감성드라마', '연상연하']",57644,9.97,여성,30대
1567,정신차리자,운명적인 만남으로 시작된 두 사람의 달콤한 사랑 이야기 정신차리자. 로맨스 요소가 더해져 더욱 흥미롭다.,['로맨스'],93119,9.7,여성,10대
1568,은퇴하고싶다,"은퇴하고싶다은 마법과 모험이 가득한 이세계에서 펼쳐지는 대모험을 그린다. 현대, 크리처 요소가 더해져 더욱 흥미롭다.","['판타지', '액션', '현대', '크리처', '고인물']",93098,9.9,남성,40대
1569,중매쟁이 아가 황녀님,"피폐 소설 속 아가 황녀로 환생하게 된 주인공은,
자신을 키우면서 고생하는 이모를 위해 폭군 남주인 삼촌이 있는 궁으로 들어설 결심을 한다.
그런데 실제로 만난 삼촌은, 그저 애정결핍이 쪼~끔 있어보일 뿐인데..?
이모도 사랑하고 삼촌도 사랑하는, 아가 황녀님의 러블리 중매 소동","['소설원작', '육아물', '회귀', '빙의', '로맨스', '완결로맨스']",84630,9.94,남성,10대
1570,오른눈이 보는 세계,"“인간은 반드시 행복해야 한다.”
칩으로 감정을 통제하는 사회. 그리고 칩을 해킹하여 환각을 보게 하는 해커. 
부정적인 감정이 금지된 세상에서 우울증을 앓고 있는 화이트해커 아연의 생존기","['완결판타지', '판타지', '아포칼립스']",119723,9.97,남성,10대
1571,김왕짱,"강북 최강의 꼴통학교 존망고. 선생님이 학생의 눈치를 보는 학교에 ‘김왕’은 그들의 왕으로 군림한다. 
어느 날 일명 ‘빠루‘라고 불리는 조폭 ’최창무‘가 전학을 오자 ’김왕’은 순식간에 그의 부하로 전락하는데….","['완결액션', '액션']",112173,9.87,남성,20대
1572,야자괴담,"어느 날 듣게 된 우리 학교의 야자 괴담. 
그날 밤, 괴담이 현실이 되어 나를 찾아왔다.","['스릴러', '완결스릴러']",106119,9.96,남성,20대
1573,그래서 나는 안티팬과 결혼했다,"세계적인 K-POP 스타 후준과 그의 공식 안티팬 이근영의
24시간 밀착 동거 리얼리티 로맨스.

※본 작품은 시리즈 오리지널 작품으로 네이버웹툰에서 듀얼연재됩니다.※","['소설원작', '로맨스', '드라마&영화 원작웹툰', '연예계', '완결로맨스', '아이돌']",442737,9.95,여성,10대
1574,공주는 잠 못 이루고,"당신 없이는 살 수 없어
나는 구원 받을 수 있습니까?","['완결드라마', '드라마']",80685,9.95,여성,30대
1575,엄마와 딸 x2,"인자한 외할머니, 깐깐한 엄마, 엉뚱한 딸이 한 집에 살게 되었다?!
본격 삼대모녀 티격태격 생활기","['완결일상', '일상']",148240,9.97,여성,30대
1576,목표,"신비로운 세계로 떨어진 주인공이 특별한 능력을 얻게 되는 목표. 배틀, 이능력 요소가 더해져 더욱 흥미롭다.","['판타지', '액션', '개그', '배틀', '이능력', 'sf']",148586,9.8,남성,30대
1577,네로의 실험실,"검은 마법사 네로와 태엽장치 아가씨 비올렛타.
그들을 둘러싸고 펼쳐지는 기묘하고 환상적인 이야기들.","['완결판타지', '판타지']",80753,9.95,남성,10대
1578,마녀 어머니와 좀비 아들,"영생을 사는 마녀와 몸이 썩어가는 그녀의 아들,
특별한 모자의 이야기.","['좀비', '눈물샘자극', '서양', '드라마', '인외존재', '마법', '판타지']",6846,9.96,여성,10대
1579,지옥2:부활자,지옥으로 끌려갔던 박정자가 부활하자 새진리회는 박정자를 이용해 화살촉의 세력을 제압하고 잃어버린 지배력을 되살리려 한다. 소도와 민혜진은 화살촉과 새진리회가 망가뜨린 세상을 복구하려 힘겨운 싸움을 이어나간다.,"['크리처', '후회물', '범죄', '미스터리', '스릴러', '사회고발', '액션', '시리어스']",31294,9.84,남성,20대
1580,황금의 세계를 너에게,"인간이 사는 '달의 왕국'과 마족이 사는 '태양의 왕국', 둘로 나뉜 세계.
달 왕국의 기사 '에스텔'은 마족의 습격으로 가족을 잃고,
이상한 마족 소녀와 엮여 시한부 인생까지 선고받는다.
살기 위해선 북쪽의 탑으로 가야 한다.
소심한 소녀 기사와 노예 소년, 유령이 된 마왕.
삶을 찾기 위한 모험을 시작하는 세 명의 이야기.","['걸크러시', '소년왕도물', '용사', '인외존재', '마법', '성장물', '판타지', '소년물']",47042,9.91,남성,10대
1581,쿠쿠쿠쿠,"어느 날, 남극에서나 사는 줄 알았던 펭귄이 너드남 공선생 집에 난입했다!
할 줄 아는 말은 '쿠쿠'밖에 없는 그 녀석은 심지어 아프리카에서 왔다나?
한국을 자신의 고향인 볼더스 비치처럼 여유와 낭만이 넘치는 곳으로 바꾸겠다는 쿠쿠와 엉겁결에 같이 살게 된 공선생.
그 둘의 앞에 하드한 K-라이프가 펼쳐지게 되는데!","['동물', '4차원', '슈퍼스트링', '개그']",13687,9.88,남성,20대
1582,가족같은 남자,"운명적인 만남으로 시작된 두 사람의 달콤한 사랑 이야기 가족같은 남자. 연예계로맨스,  햇살남 요소가 더해져 더욱 흥미롭다.","['로맨스', '연예계로맨스', '햇살남']",303891,9.94,여성,30대
1583,헬스 시궁창인생 고등학교,"진성 헬창 김수컷은 헬스시궁창 고등학교에 입학시험을 치르러 갔다.
그런데 학교 입구부터 가파른 언덕길에 등교생들은 어깨에 자신이 하루동안 마실 물을 이고 워킹런지로 길을 오르고 있었다.
김수컷은 흥분했다. 이것이 내가 원하던 학교라고...!","['개그', '완결개그']",97310,9.78,남성,20대
1584,몸이 바뀌는 사정,"황태자는 하룻밤을 보낸 여성과 몸이 바뀌는 저주를 받았고,
나는 그 저주를 풀지 못해 멸문당하는 공작가의 딸이 되었다.

저주를 풀고자 무심한 그를 유혹해 하룻밤까지 보냈다.
저주 해제약도 먹였겠다, 그에게 관심을 끊었는데……

설상가상 풀려야 할 저주는 풀리지 않고
이젠 예고도 없이 수시로 몸이 바뀌게 되었다?
원래 몸으로 돌아가는 방법은 단 하나, 서로의 몸을 탐하는 것뿐.","['걸크러시', '로맨스', '빙의', '직진남', '집착물', '성별반전', '로판', '삼각관계']",124993,9.96,여성,10대
1585,흑사,"강호를 떠도는 검객의 모험과 성장을 다룬 흑사. 정통무협,  시리어스 요소가 더해져 더욱 흥미롭다.","['무협/사극', '정통무협', '시리어스', '동양']",97427,9.96,남성,40대
1586,신이 담긴 아이,"이승과 저승 사이, 신의 피가 흐르는 아이들을 위한 무당학교에 '예언의 아이'가 나타났다. 어린 시절부터 악귀가 꼬이던 소녀 금화주, 무당학교에 입학하게 되는데..! 금화주와 소녀들의 성장기.","['완결판타지', '판타지']",45077,9.92,남성,10대
1587,신과함께 회귀한 기사왕님,"신과함께 회귀한 기사왕님은 마법과 모험이 가득한 이세계에서 펼쳐지는 대모험을 그린다. 사이다, 회귀 요소가 더해져 더욱 흥미롭다.","['판타지', '액션', '사이다', '회귀', '헌터물']",125009,8.3,남성,10대
1588,커넥트,"[드라마원작] 그 놈은 날 죽였다. 
하지만 난 되살아났고 그놈에 복수하기로 했다.
내 눈을 가져간 자기 눈에 이식한 그놈이 보는 풍경이 내게도 보인다.
누군지 모르겠지만 곧 다시 만나게 될 것이다.","['스릴러', '완결스릴러', '드라마&영화 원작웹툰']",62845,9.58,남성,20대
1589,몬스터힐링,"평범했던 주인공이 판타지 세계에서 영웅으로 성장하는 몬스터힐링의 이야기. 힐링, 인외 요소가 더해져 더욱 흥미롭다.","['판타지', '액션', '힐링', '인외', '음식']",13694,9.7,남성,30대
1590,미래소녀,"소녀가 바라본 미래의 기억들
<인간의 숲> 황준호 작가의 신작","['스릴러', '완결스릴러']",128636,9.96,남성,20대
1591,달수 이야기,"산촌 남고에 전학 온 김주혜, 아니 김달수의 고된 남장 생활.
본 작품은 2014 네이버 수퍼루키 공모전 당선작품입니다.","['개그', '완결개그']",307527,9.98,남성,20대
1592,그렇게 물거품이 되어서,"평범했던 주인공이 판타지 세계에서 영웅으로 성장하는 그렇게 물거품이 되어서의 이야기. 모험, 크리처 요소가 더해져 더욱 흥미롭다.","['판타지', '모험', '크리처', '성장물']",129095,9.9,남성,10대
1593,천하제일인 대사형,"천하제일인 대사형은 독특한 스토리와 매력적인 캐릭터들로 구성된 흥미진진한 웹툰이다. 사이다, 복수극 요소가 더해져 더욱 흥미롭다.","['무협', '사이다', '복수극', '환골탈태']",128944,9.9,남성,30대
1594,세자와 세자빈의 계약결혼전,"현실적인 갈등과 인간관계를 다룬 세자와 세자빈의 계약결혼전은 깊은 감동을 선사한다. 동양풍로맨스, 결혼생활 요소가 더해져 더욱 흥미롭다.","['드라마', '동양풍로맨스', '결혼생활', '왕족']",63022,9.9,여성,30대
1595,신림체육관,"신림체육관은 압도적인 액션과 스릴 넘치는 전개로 독자들을 사로잡는다. 소년물, 격투기 요소가 더해져 더욱 흥미롭다.","['액션', '소년물', '격투기', '학원물']",298866,9.6,남성,10대
1596,개구리 인간,"7년 전, 개구리의 모습을 한 ""개구리족""들이 대한민국에 나타난다.
그들을 향한 적개심, 혐오가 만연한 사회 속에 주인공 “이정우”는
자신의 와이프 그리고 딸과 함께 행복한 가정을 유지하는 것이 목표이다.
그러던 어느날 옆 집으로 한 개구리족이 이사를 오면서 끔찍한 일들이 벌어진다.","['2023 지상최대공모전', '절망적인', '스릴러', '사회고발', '고자극스릴러', '시리어스']",32037,9.83,남성,30대
1597,사공은주,"술집 알바생 '민준'은 어느날 천년의 이상형 '은주'를 보게 된다. 
그 후 그녀의 SNS를 찾아내 관음하는 것이 일상이 된 민준.
민준은 은주에게 접근하기 위해 옆방으로 이사까지 하지만, 은주 곁엔 늘 깡패 같은 남자친구 '현태'가 있었다. 
충격도 잠시, 현태와 싸운 은주가 상처투성이가 되어 나타나자 민준은 크게 분노하고,
은주를 현태로부터 구해겠다는 일념 하에 스스럼없이 도를 넘은 행동들을 하며 악질 스토커가 되어간다. 
그러던 와중 민준의 방에도 수상한 흔적들이 포착되고, 충격적인 사건들이 원룸 내부에서 벌어진다.","['2021 지상최대공모전', '스릴러', '완결스릴러']",63379,9.92,남성,20대
1598,스토커의 하루,옆집엔 스토커가 살고 윗집엔 미치광이가 산다! 끔찍한 기억의 고시원에서 벗어나 허름한 원룸으로 도망쳐 나온 미대생 ‘김하루’. 이사 온 지 한 달 만에 옆집에는 자살 사건이 발생하고 그 방엔 음침하고 수상해 보이는 여자가 이사 온다. 그러던 어느 날 집으로 돌아온 김하루의 눈앞에 자신의 방에서 식칼을 든 채 서 있는 옆집 여자와 마주치게 되는데… “하루씨… 난 당신을 위해 뭐든 할 수 있어.”,"['후회물', '범죄', '자극적인', '집착물', '스릴러', '고자극스릴러', '시리어스', '까칠녀']",54474,9.29,남성,30대
1599,따개비,"작은 무인도, 굴덕도의 등대 관리 공무원 이어진.
평소처럼 평화롭고 지루한 등대에서 시간이나 때우던 어느 날,
친한 낚시꾼이 넘겨준 감생이에서 표피를 뚫고 나온
괴이한 따개비를 보게 된다.

그리고 그 후...","['소설원작', '스릴러', '완결스릴러']",20731,8.88,남성,20대
1600,순정일지,"운명적인 만남으로 시작된 두 사람의 달콤한 사랑 이야기 순정일지. 로맨스코미디,  캠퍼스로맨스 요소가 더해져 더욱 흥미롭다.","['로맨스', '로맨스코미디', '캠퍼스로맨스']",63665,9.95,여성,10대
1601,아이스크림 소년,"운명적인 만남으로 시작된 두 사람의 달콤한 사랑 이야기 아이스크림 소년. 햇살녀,  학원로맨스 요소가 더해져 더욱 흥미롭다.","['로맨스', '햇살녀', '학원로맨스', '까칠남']",63480,9.93,여성,10대
1602,신군,"악마에게 모든 걸 잃고 먹이로 사육당하는 소년.
이를 갈며 복수를 갈망하지만 인간의 힘은 악마에게 닿지 못했다.
그때 그의 앞에 신군이 나타난다.
2020 지상최대공모전 2기 장려상 수상작!","['소년왕도물', '완결액션', '액션', '2020 지상최대공모전']",101781,9.95,남성,20대
1603,경기 GO,""" 본 컨텐츠는 경기도/경기관광공사의 브랜드 웹툰으로 HO9 작가가 전하는 경기지역 대표 음식입니다. ""
요리GO 주인공 한별의 에피소드를 담고 있습니다.","['완결드라마', '완결무료', '드라마']",9629,9.91,여성,30대
1604,공주님이위험해,"유쾌하고 재미있는 에피소드들로 가득한 개그 웹툰 공주님이위험해. 이능력, 왕족/귀족 요소가 더해져 더욱 흥미롭다.","['개그', '이능력', '왕족/귀족', '병맛']",101952,9.3,여성,30대
1605,원수를 사랑하라,"고생 끝, 인생 리셋!.... 도 못했는데 과거를 들키다?!
늦깎이 대학생 배연희의 고군분투 캠퍼스 로맨스!","['완결로맨스', '계약연애', '로맨스', '캠퍼스로맨스']",458177,9.92,여성,10대
1606,냥하무인,"내가 선물이니까 넌 닥치고 받아
#안하무인 #뚱냥이 #인간세상 출몰","['개그', '완결개그']",58846,9.93,남성,20대
1607,크립티드 로빈,"크립티드 로빈은 압도적인 액션과 스릴 넘치는 전개로 독자들을 사로잡는다. 현대판타지,  아포칼립스 요소가 더해져 더욱 흥미롭다.","['액션', '판타지', '현대판타지', '아포칼립스']",20745,9.73,남성,30대
1608,웃지 않는 개그반 시즌3,미친예술고 개그반에 저주가 내려졌다!,"['개그', '완결개그']",145098,8.72,남성,20대
1609,야부리맨,"말하는대로 모든 것이 이루어진다?! 
역대급 슈퍼히어로의 초특급 재능낭비! 
미티 작가의 컷툰 신작","['개그', '완결무료', '완결개그']",114639,9.84,남성,20대
1610,악플게임,"우승상금 10억! 
대한민국 최고의 악플러를 뽑는 대회가 펼쳐진다. 
<남기한 엘리트만들기>, <고삼이 집나갔다> 미티 작가 신작!","['완결드라마', '드라마']",235624,9.84,여성,30대
1611,내면의소리2,"독특한 캐릭터들의 엉뚱한 일상을 그린 코미디 내면의소리2. 공감, 결혼생활 요소가 더해져 더욱 흥미롭다.","['개그', '일상', '공감', '결혼생활', '일상개그힐링']",235711,9.9,남성,40대
1612,동네변호사 조들호 시즌1,본격 생활법정만화 동네변호사 조들호,"['완결드라마', '법정드라마', '드라마&영화 원작웹툰', '드라마']",124913,9.94,여성,30대
1613,N의등대-도망자,"동일한 세계의 색다른 4가지 이야기 
함께 볼 수도, 따로 볼 수도 있는 멀티 플롯 프로젝트 만화 
김선권 작가의 N의등대 도망자편","['완결스릴러', '스릴러', '완결무료']",15960,9.74,남성,20대
1614,형사본색,"형사 한태양이 특진하던 날, 아내가 자살하고 딸은 희귀병 판정을 받았다.
감당할 수 없는 딸의 치료비에 절망하던 태양은 압수물 보관센터인 '제로하우스'에 수 천억원의 가치를 지닌 훈민정음 해례본이 숨겨져 있다는 것을 알게 되고,
딸의 병원비를 위해 의도적으로 제로하우스에 좌천되어 훈민정음 해례본을 탈취하려 하는데...!","['범죄', '동양', '현대', '두뇌싸움', '완결액션', '느와르', '액션', '시리어스']",17474,9.78,남성,20대
1615,그마남 이야기,"그 마법사가 남기고 간 이야기.
마법이 사라진 지 어언 300년. 이 세상에 남은 마지막 마법사와 제물.사랑과 우정과 희망, 
거기에 독자의 인내심마저 부숴버릴 호구들의 이야기.","['세계관', '판타지', '완결판타지']",6814,9.97,남성,10대
1616,생존로그,"구독자 300만을 자랑하는 위투버 '쌈쏜'은 다섯 명의 BJ들과 함께 무인도 섬에서 방송을 시작한다. 
그들은 보다 자극적인 컨텐츠에 욕심이 생겨 섬의 더 깊은 곳으로 들어가고 무인도인줄 알았던 그곳에는 언제 지어졌는지 알 수 없는 낡은 벙커가 있다. 
호기심과 두려움이 공존하던 그 때 일행을 위협하는 '무언가'의 습격이 시작된다.","['아포칼립스', '완결액션', '서바이벌', '액션', '인플루언서']",70432,9.86,남성,20대
1617,달라 보여도 모두 같은 가족,"본 컨텐츠는 여성가족부의 브랜드 웹툰으로 김진, 신태훈, 나승훈 작가가 전하는 가족 다양성 캠페인 입니다.","['완결일상', '일상', '완결무료']",12853,9.66,여성,30대
1618,모퉁이 뜨개방,"회색빛 일상에 지쳐있던 현이
어느 날 만나게 된 모퉁이 뜨개방에서 자신의 상처를 마주하며 치유해간다","['감성', '완결감성']",116255,9.97,남성,20대
1619,프린스의 왕자,"꽃미남들로 이루어진 게임제작사 
'캐슬소프트'의 존폐를 걸고 펼쳐지는
 두 완벽남의 좌충우돌 코믹 스토리","['레드스트링', '개그', '완결개그']",212971,9.97,남성,20대
1620,달콤한 인생,"커플과 싱글들의 달콤한 이야기
직장인과 백수들의 달콤한 에피소드
...그런데 왜 이렇게 씁쓸한거지?","['공감성수치', '완결일상', '일상']",147989,9.95,여성,30대
1621,어쩌다 보니 제물이 되었습니다!,"이세계로 소환되어 용왕의 제물이 된 주인공 김공희.
원래 세계로 돌아가기 위해서는 소환한 자들의 도움이 필요하다.
용왕은 그들을 찾아주는 대가로 김공희에게 계약 혼인을 제안하는데···.

이세계에서 펼쳐지는 우당탕 개그 로맨스!","['동양', '병맛', '개그', '공식미남', '가벼운', '로맨틱코미디', '왕족/귀족', '동양풍로맨스']",21406,9.95,여성,20대
1622,나의 신은 욕망꾸러기,"평생 욕심없이 살아온 소심한 윤리교사 전햇살, 그녀의 옆집에 욕망과 쾌락의 신이 이사왔다.
섹시한 외모에 치명적인 향기를 내뿜는 그의 이름은 ‘디오니소스’, 줄여서 디오.
디오가 신계 와인을 제조할 때 꼭 들어가야 하는 재료는 인간의 평생 이루지 못한 짙은 욕망이다.
그걸 가진 건 바로 햇살! 바라는 거라곤 그저 반복되는 평온한 일상 뿐, 여타 다른 꿈이나 욕망이라곤 1도 없이 살아온 햇살인데…
디오는 햇살의 깊은 곳의 욕망을 깨워내기 위해 신의 능력까지 사용해가며 그녀를 쉴새없이 귀찮게 굴기 시작한다.","['능글남', '로맨스', '자극적인', '신화', '햇살녀', '설렘폭발', '러블리', '햇살캐']",191389,9.93,여성,10대
1623,집착 흑막들의 시터가 되어버렸다,"소설 <샤키르의 꽃>의 엑스트라, 황제를 위한 인간 제물인 '성녀 메이아'에게 빙의 되었다.
""남을 위해 죽고 싶지는 않아!"" 비록 원해서 얻은 새로운 삶은 아니지만, 또다시 비참하게 죽는 건 절대 사양이다.
억울한 마음에 신전을 탈출한 것까진 좋았는데... 어쩌다 보니 흑막의 쌍둥이 동생들에게 관심을 사버렸다.
설상가상으로 내 능력에 취한 흑막의 집착까지?
그것도 여주인공을 갖기 위해 납치와 감금, 테러까지 저지르는 작중 최고 흑막에게!!","['로맨스', '서양', '신화', '집착남', '악역이주인공', '흑막녀', '왕족/귀족', '까칠녀']",93341,9.93,여성,10대
