rank,title,summary,tags,interest_count,rating,gender,ages
2319,다섯번째 벽,"심리상담사가 꿈인 '현정'은, 어느날 같은반 친구인 '정현'의 상담을 맡게 된다.
방과후의 충격적인 고백을 계기로, 벽이 느껴졌던 둘의 사이는 급격히 가까워지게 된다.
사랑과 인생, 그리고 꿈에 관해 그들은 수많은 이야기를 나누고, 비로소 둘도 없는 친구 사이가 된다.
그러나, 현정은 알지 못했다. 만화의 결말에서 정현이 결국 죽게 된다는 것을.","['완결드라마', '드라마']",24097,9.89,여성,30대
2320,이 주길럼의 전장,"“본 컨텐츠는 워헤이븐의 브랜드 웹툰으로 김세훈 작가가 전하는 <이 주길럼의 전장> 입니다.""
싸우는 자에게 구원이 오는 워헤이븐 전장!
현실 세계에서 넘어온 이길럼과 워헤이븐 세계의 길럼이 복수를 위해 싸우는 이야기","['완결판타지', '판타지', '완결무료']",2943,9.47,남성,10대
2321,옥타곤 리벤지,"""치고받고 서로가 피를 보는, 그딴 게 스포츠야?"" 

목표가 없고 무미건조한 일상을 살아가던 하율은 
친구 홍민과 코치 상준에 의해 인생의 터닝포인트를 맞이한다. 

어릴 적 아빠와의 추억이 담긴 격투기. 
하지만 격투기는 하율의 아빠를 죽음으로 몰아넣었다. 

아빠를 죽음으로 몰아넣은 장본인 존스 알베스에게 복수하기 위해 
하율은 다시 글러브를 잡다. 

""재능 위의 재능, 하율은 그 벽을 뚫을 수 있을까?""","['완결액션', '액션']",23397,9.51,남성,20대
2322,버그이터,"랭킹 1위 버그 플레이어 '김지한'은 어느 날 의문의 유저에게 캐릭터를 삭제당하고 1레벨이 된다. 
'버그 쓰지 말 걸..' 후회하던 그때 찾아온 새로운 기회.
""다시 랭커로 만들어 줄게. 너 같이 버그 쓰는 놈들 때려잡는 방식으로.""

최강 버그 플레이어, 버그 잡는 '버그이터'로 갱생하다!","['2021 지상최대공모전', '먼치킨', '완결판타지', '판타지', '게임판타지']",36221,9.8,남성,20대
2323,채수연,"채수연은 20대 중반의 검사로 예의 바른 성품이지만 경우에 틀린 일에는 싸움닭처럼 달려들며 그 누구에게도 뒤지지 않는 실력을 뽐낸다. 
이 세상에서 자기 자리에서 제대로 일하는 단 한 명, 검사 채수연.
세상을 바꾸는 첫 번째 퍼즐조각이 될 것인가.","['완결드라마', '법정드라마', '드라마']",9327,9.8,여성,30대
2324,이모털 헐크,"낮의 브루스 배너는 죽음 앞에 무력하다. 하지만 이 연약한 인간이 쓰러지고 밤이 오면, 그땐 헐크의 시간이 시작된다!
미지의 '녹색 문'을 넘어 지옥 밑바닥에 도착하는 배너 일행. 그러나 지옥보다 위험한 것은 헐크 자신이다!
감마 실험체들을 노리는 잔인무도한 적들의 등장으로 헐크의 친구, 연인, 모든 주변인물이 혼돈에 빠지는데….","['완결액션', '액션']",23647,9.8,남성,20대
2325,블러드 리벤저,"어느 날 정체불명의 괴물 이블에게 습격 당한 '금마루'는 
이블을 사냥하는 리벤저 '제이.화이트'에게 도움을 받게 된다.

'금마루'는 그 사건을 계기로 오랜 시간 이어져 온 이블과 리벤저 간의 전쟁에 개입하게 되는데...","['완결판타지', '판타지', '2021 지상최대공모전']",39925,9.82,남성,10대
2326,숨겨진 성녀,"오래 전, 성녀를 사랑했던 성기사가 있었다. 사사로운 감정을 가지면 안 되는 성녀에게 해가 될까 그는 늘 한 발짝 떨어져서 성녀를 지켰다. 하지만 성녀는 결국 성기사의 품에서 최후를 맞이하고, 성기사는 비통하게 맹세했다. ‘제게 다음 생이 있다면, 그때는 당신을 성녀로 살게 하지 않겠습니다.’ 
기나긴 300년의 시간이 흘러, 성녀는 다시태어났다. 이번 생에는 두사람의 염원이 이루어질 수 있을까?","['소설원작', '회귀', '로맨스', '완결로맨스']",61754,9.92,남성,10대
2327,당신의 여자가 되고 싶어요,"성하윤 마음 속 갖고싶은 남자 1위, 문신휘!
다정하지만 연애에 있어서 만큼은 철벽남 신휘를 얻기 위한
계략녀 하윤의 맹랑 발칙한 계획들이 펼쳐진다.

생각은 짧게. 행동은 빠르게!
철옹성을 함락하기 위한 고군분투 로맨스","['소설원작', '로맨스', '완결로맨스']",57834,9.4,여성,10대
2328,THE 런웨이,"하룻밤을 같이 보낸 그 남자가 내 상사라고?!
패션지 <The Runway>의 에디터 유지안. 그녀는 약혼자의 양다리 소식에 무작정 파리로 떠난다.
그곳에서 우연히 만난 남자와 충동적으로 하룻밤을 보내 버리고…
3개월의 시간이 흐른 후, 지안의 회사에 만렙의 편집장이 프랑스에서 오게 된다. 그런데 그 남자… 바로 지안과 하룻밤을 보낸 프랑스에서의 그 남자다!!","['소설원작', '사내연애', '로맨스', '오피스로맨스', '완결로맨스']",117975,9.83,여성,10대
2329,사막에 핀 달,"사막의 전사 나디아. 신녀를 찾아 사막에 온 신관 이세리온은 나디아에게 신녀가 되어달라고 말한다. 
나디아는 부족을 지키기 위해 신녀가 되기로 결심하지만, 
야만인이라고 무시받는 상황에서 나디아는 과연 진짜 신녀가 될 수 있을까? 
신녀로 선택받은 나디아와 신관 이세리온의 이야기.","['무협/사극', '완결무협/사극']",22225,9.84,남성,20대
2330,골기퍼,"골기퍼은 독특한 스토리와 매력적인 캐릭터들로 구성된 흥미진진한 웹툰이다. 열혈,  소년물 요소가 더해져 더욱 흥미롭다.","['스포츠', '열혈', '소년물', '우정']",57859,9.87,남성,10대
2331,낢다른 광화문광장 이야기,본 컨텐츠는 서울특별시 광화문광장추진단의 브랜드 웹툰으로 서나래 작가가 전하는 미리보는 광화문광장이야기 입니다.,"['완결일상', '일상', '완결무료']",4416,6.35,여성,30대
2332,미스터 해녀,"제주도에 정착한 웹툰작가 빡세,
과연 그는 해녀 학교의 모든 훈련을 무사히 마치고
해녀왕이 될 수 있을까?","['개그', '완결개그']",5889,9.32,남성,20대
2333,스윗솔티,"이번 알바는 잘리면 안 된다!!
욱하는 성격에 매번 사고만 치는 경찰 준비생의 성질 개조 알바가 시작됩니다.","['완결드라마', '드라마']",97499,9.97,여성,30대
2334,유령극단,유령들을 위한 진혼극의 막이 오른다!,"['완결판타지', '판타지']",67759,9.93,남성,10대
2335,참새는 새!신부,"장수하고 싶은 참새, 
인간을 사로잡으러 왔다!","['완결로맨스', '인외존재', '로맨스']",91928,9.95,여성,10대
2336,와장창창! 자취맨,"자취인생의 리얼함을 보여준다!
세 남자의 엉망진창 자취 이야기!!","['완결일상', '일상']",54772,9.95,여성,30대
2337,영업천재,"신비로운 세계로 떨어진 주인공이 특별한 능력을 얻게 되는 영업천재. 현대, 오피스 요소가 더해져 더욱 흥미롭다.","['판타지', '일상', '현대', '오피스', '회귀']",67791,9.9,남성,40대
2338,호러와 로맨스,"사랑을 알고 싶은 호러 작가와 
공포물은 질색인 인기 로맨스 작가의 
오싹달콤한 로맨스 제작기","['완결로맨스', '로맨스']",117482,9.98,여성,10대
2339,오늘도 고양이답게,"본 컨텐츠는 고양이사료 위스카스의 브랜드 웹툰으로 김진 작가가 전하는 영국 연구센터 방문기입니다. 

고양이집사 2년차 김진, 위스카스 고양이 연구 50년의 노하우를 담은 ‘키튼 칼리지’ 영상의 배경인 월썸연구센터를 다녀오다!","['완결일상', '일상', '완결무료']",22833,9.93,여성,30대
2340,나비를베는검,서로 다른 환경의 두 사람이 만나 진정한 사랑을 찾아가는 나비를베는검. 로맨스 요소가 더해져 더욱 흥미롭다.,['로맨스'],54783,9.9,남성,10대
2341,구운세상,"본 컨텐츠는 쿠키런의 신작, 쿠키런: 오븐브레이크의 브랜드 웹툰입니다.

어느 날, 그가 알던 모든 것이 사라졌다!

최고의 제빵사를 꿈꾸던 평범한 고등학생에게 갑작스럽게 다가온 사건","['완결드라마', '완결무료', '드라마']",26355,9.78,여성,30대
2342,레코닝,내가 살려면 또 다른 내가 죽어야 한다!,"['완결판타지', '판타지']",121484,9.97,남성,10대
2343,10대훈녀클럽,"파릇파릇 새싹훈녀 양성소!

10대훈녀클럽에서 밝혀지는 우리답게 예뻐지는 뷰티시크릿!

본 웹툰은 기량 작가님과 함께하는 티엔의 브랜드 웹툰입니다.","['완결드라마', '완결무료', '드라마']",38544,9.53,여성,30대
2344,새벽9시,"어둠이 멈춰버린 시간 새벽 9시.
오지마을 '오왕리'가 감추고 있던 비밀이 드러난다.","['스릴러', '완결스릴러']",74384,9.7,남성,20대
2345,비바 산티아고,"스페인을 동에서 서로 가로지르며 천년의 신화를 간직한 ‘산티아고 길’ 
별들의 들판을 향한 800km의 여행이 지금 시작된다.","['완결일상', '일상']",7207,9.83,여성,30대
2346,뜨거운 것이 좋아.,"찜질방에서 벌어지는 청춘 남녀들의 사랑과 고민,
그리고 다시 세상으로 돌아가기 위해 숨고르기를 하는 이웃들의 이야기.","['완결무료', '로맨스', '완결로맨스']",34254,9.66,여성,10대
2347,헬창던전,"강력한 적들과의 치열한 전투를 그린 액션 웹툰 헬창던전. 사이다, 4차원 요소가 더해져 더욱 흥미롭다.","['액션', '사이다', '4차원', '이세계']",38545,9.9,남성,30대
2348,겨울동화,"<일편단심화> 심윤수 작가의 겨울 이야기.

올 겨울을 따뜻하게 채워 줄 에피소드 12편.어른을 위한 동화가 시작됩니다.","['감성', '완결감성', '완결무료']",4198,9.89,남성,20대
2349,아이러브올림픽게임즈,"4년간의 땀과 노력이 아름다운 대표선수들! 
감동 가득한 선수들의 도전 이야기~ 네이버 웹툰 작가들이 바라보는 올림픽은 이렇습니다","['스포츠', '완결스포츠', '완결무료']",124,8.96,남성,20대
2350,한량은 빡세,"[빡세가 제주에서 살아남는 방법!]

제주 락페 개최, 떡볶이 사업, 본격적인 어업 활동(해녀 학교에서 배운 물질) 등 빈털터리 빡세가 제주에서 살아남는 방법! 
웃음과 눈물을 자아내는 빡세의 본격 제주 생존기","['일상개그힐링', '완결일상', '일상', '하이퍼리얼리즘']",2495,9.3,여성,30대
2351,조선롹스타,"조선시대 ‘장악원’꼴찌 악공 ‘김 중립’은 어느 날 사이비 무당에게 속아 굿을 잘못 받는다. 
그 덕에 21세기 최고의 락 보컬리스트 ‘김유나’가 빙의해버린다! 
졸지에 귀신에 씌인 ‘중립’은 ‘유나’를 미래로 되돌리기 위해 한 번 더 굿을 받으려 한다. 
그런데! 굿을 받으려면 200냥이 필요하다고?!
공노비 신세에 거지인 ‘중립’은 <팔도 노래자랑>에 나가 상금을 타기 위해 조선시대 최초의 ‘락 밴드’를 만드는데. 우당탕탕 조선시대 롹밴드 탄생기☆","['역사판타지', '개그', '완결개그']",728,9.64,남성,20대
2352,신의 최애캐,"모든 것이 완벽한 고등학생 홍강후. 하지만 딱 하나, 그에게 허락되지 않은 것은 바로 '연애'다.
4월 8일 고백데이를 앞두고 드디어 '모쏠인생' 강후에게도 봄날이 오는가 싶었는데...","['완결드라마', '타임슬립', '2022 지상최대공모전', '드라마']",23092,9.78,여성,30대
2353,자장자장,"악마 중에 가장 강력하고 가장 지독한 악마는 바로... 자도 자도 잠이 오게 하는... 잠의 악마, 수마다!
600년간 한 번도 잠이 든 적 없는 수마는 자신의 주문에 걸려들지 않는 인간 여자를 만나 처음으로 휴식을 취한다. 
“이렇게 좋은 인간 비타민이 있다니. 아주 기특하군.” 
특별대우를 하며 그녀를 챙기는데. 아뿔싸, 푹 빠져버렸다. 한낱 하찮은 인간에게.","['완결로맨스', '로맨스']",30334,9.73,여성,10대
2354,R-X,"300년 전 발생한 제3차 세계 대전은 생화학전으로 번지게 되고, 이때 등장한 변종 R-바이러스는 인간을 잡아먹는 초능력 괴물 레이어를 탄생시킨다.
이들에 대항하기 위해 레이어의 하위호환 능력을 보유하게 된 10명의 전사 R-X! 이들의 손에 인류의 생존 멸망이 달려있다!
R-X에게 명령한다! 레이어로부터 인류를 구하라!","['감염', '액션', '완결액션']",7976,5.35,남성,20대
2355,선남친 후연애,"복학생 선배의 끈질긴 구애로 고통받던 가은은 학교 내 뜬소문으로 오해받고 있던 재림과 합의하에 쇼윈도 커플이 되기로 한다.
진지한 연애는 절대 하지 않기로 했으나 재림은 예상보다 훨씬 달콤하게 다가오고, 가은은 가랑비 젖듯 재림에게 끌리고 마는데… 
쿨 찾다 핫하게 엮여버린 쇼윈도 커플의 간질간질 캠퍼스 로맨스!","['계약연애', '청춘로맨스', '로맨스', '소설원작', '로맨스코미디', '캠퍼스로맨스']",162391,9.89,여성,10대
2356,나라 구한 전생,"아버지의 빚 문제로 폐공장에 납치되어 있던 한자인은 재수 좋은 남자 천운조의 등장으로 무사히 풀려나게 된다. 
며칠 후, 새 학기가 시작되고 신입생 한자인은 자신의 학교에서 천운조와 그의 친구들을 만나게 된다. 
자신들을 전생에 나라를 구한 영웅이라고 소개하는 천운조와 친구들, 
그들의 특별한 능력을 눈으로 볼 수 있는 한자인, 그리고 한자인을 노리는 수수께끼의 인물까지. 
전생을 기억하는 능력자들과 그 중심에 있는 한자인, 그들에게 과연 어떤 운명이 기다리고 있을까?","['드라마', '완결드라마']",12946,9.88,여성,30대
2357,혀로 만난 사이,"맵고 짜고 단거!에 환장하는 야식러버 예능 막내 피디 신달아.
식단 관리 끝판왕 탑배우 조진국과...혀가 연결되었다?!
이후 진국은 자신의 핫바디를 지켜내기 위해 달아의 야식인생을 끝장내려 갖은 수를 쓰는데..
그렇게 시작된 두사람의 식.단.전.쟁!
한편, 굶주린 달아 앞에 나타난 매력적인 셰프가 있었으니.. 그의 다정한 요리는 달아의 마음을 온통 빼앗고 셰프와의 본격 썸이 시작된다. 
달아가 먹는 것을 막으려는 배우 진국과 달아에게 뭐든 먹이고 싶은 썸남 셰프
두 남자 사이에서 갈팡질팡하는 달아의 혀 끝에는 어떤 달콤함이 남게될까?
혀로 만나게 된 세 사람의 짜릿한 삼각로맨스가 시작된다!
2020 지상최대공모전 장려상 수상작!","['로맨스', '2020 지상최대공모전', '완결로맨스']",26169,8.87,여성,10대
2358,블랙 위도우,"MCU 페이즈4의 시작, 강렬한 액션을 원작으로!
전직 KGB 킬러, S.H.I.E.L.D. 요원, 어벤저스 멤버였던 나타샤 로마노프.
과거에 남긴 발자국이 그녀를 찾아온다.
‘울보 사자’라 불리는 악당이 텔레파시 능력을 이용해 블랙 위도우를 협박하고,
암살자 양성 기관 레드 룸 잔당은 새로운 학교를 설립해 또 다른 소녀들을 훈련시키고 있었다.
위도우는 허락할 수 없다…. 자신과 같은 운명의 소녀들이 세상에 또 만들어지는 것을!","['해외작품', '히어로', '액션', '완결액션']",34667,9.87,남성,20대
2359,예쁜 사나이,"무시무시한 외모와 강한 완력. 공포와 두려움을 주는 존재. 
남자 중의 남자 '상남자'로 불리는 ‘노다지’ 
하지만 속마음은 누구보다도 친구들과 잘 지내고 싶은 평범한 고등학생일 뿐! 

어느 날 예쁜 외모를 뽐내는 '영기'가 전학을 오게 되고, 인기폭발인 그 모습에 무릎을 탁 아니 쾅! 치게 되는데… 
과연 다지는 편견과 선입견에 맞서 예뻐질 수 있을 것인가?!","['드라마', '학원물', '성장드라마', '완결드라마']",37497,9.94,여성,30대
2360,그림자 신부,"빚 갚을 돈을 벌려다가 끔찍한 위기에 빠진 설윤 앞에 신검 ‘월흔’을 든 핏빛 무사가 나타난다. 
절체절명의 위기에서 구해준 건 고맙지만 난데없이 밤시중을 들라는데...
다음 날, 7년 전쟁의 승리를 축하하는 행진 중 왕세자가 든 신검이 낯설지 않다!
“어젯밤 그가 왕세자였어?!!”","['완결로맨스', '로맨스', '동양풍판타지', '소설원작']",62036,9.89,남성,10대
2361,풋내기들,"스무 살의 봄, 새봄은 두근거리는 마음으로 대학교 인근의 셰어하우스에 입성한다. 
그곳에서 외모와 성격이 전혀 다른 룸메이트 희주 그리고 최애 라욱과 똑같이 생긴 이상형까지 만난다. 
풋풋하지만 많은 것이 서툴렀던 스무 살, 우리들의 이야기! 
첫사랑의 설렘을 가득 담은 셰어하우스로 놀러 오실래요?","['로맨스', '캠퍼스로맨스', '완결로맨스']",131796,9.96,여성,10대
2362,셋뿐인 교실,"운명적인 만남으로 시작된 두 사람의 달콤한 사랑 이야기 셋뿐인 교실. 청춘, 성장물 요소가 더해져 더욱 흥미롭다.","['로맨스', '청춘', '성장물', '학원로맨스']",12980,9.8,여성,10대
2363,좀비상조,"좀비상조은 예측할 수 없는 전개와 충격적인 진실을 담고 있다. 미친작화,  아포칼립스 요소가 더해져 더욱 흥미롭다.","['스릴러', '미친작화', '아포칼립스', '좀비']",26172,9.92,남성,30대
2364,보살님이 캐리해!,"억겁의 시간을 넘어 환생한 보살들이여 
야차들의 습격에서 평화로운 일상과 법화를 수호하라!","['오컬트', '액션', '완결액션']",34758,9.92,남성,20대
2365,빅맨,"키가 크다는 건 엄청난 축복이라고?
208cm인 나한테는 그저 저주일 뿐이다!

큰 키를 가진 은덕은 입학 첫날부터 여러 체육 부서 선배들에게 쫓기게 되는데... 
그때 같은 반 여자아이에게 도움을 받게 된다.
그런데 그녀가 데리고 간 곳이 다름 아닌 농구장..?!

빅맨 나은덕의 청춘 성장 학원물!!","['스포츠성장', '농구', '완결스포츠', '스포츠']",117689,9.75,남성,20대
2366,몰랐지만 괜찮아,"본 콘텐츠는 문화체육관광부와 한국저작권위원회의 브랜드웹툰으로
캐릭터를 도용 당한 강남이, 온라인 강의를 잘못 이용한 성은의 에피소드를 이저녁, 이온도 작가가 함께 전달합니다!","['일상', '완결일상', '완결무료']",29033,9.93,여성,30대
2367,수상한 비밀상담부,"태희는 같은 반 해원이 자꾸만 자기를 쳐다보는 게 신경 쓰인다.
쳐다보는 이유를 알기 위해 방과후 해원을 쫓아가는데…
골목길에서 해원이 웬 남자애랑 지금 뭐 하는 거지?!
충격과 혼란이 가득한 태희에게 해원이 건넨 말, 
""야, 네 뒤에 귀신 붙었다.""
귀신 찾는 놈, 김찬!
귀신 잡는 놈, 최민우!
귀신 같은 놈, 김해원!
귀신 꼬이는 놈, 한태희!
개성 강한 네 사람의 우당탕탕 오컬트 청춘 성장 드라마!!","['스릴러', '완결스릴러']",61535,9.92,남성,20대
2368,동네몬스터,"화려한 과거의 아저씨X정의의 고등학생
두 명의 몬스터가 동네의 평화를 지킨다!","['액션', '완결액션']",36632,9.89,남성,20대
2369,조선홍보대행사 조대박,"냉혈한 광고홍보의 귀재
조선 시장에서도 성공할 수 있을까?","['개그', '완결개그']",31381,9.9,남성,20대
2370,여심강타(feat.금연),"본 콘텐츠는 보건복지부의 브랜드 웹툰으로 야옹이 작가가 전하는 청소년 흡연예방 캠페인입니다. 
심쿵매력남 주영이에게 나타난 운명의 그녀는?","['드라마', '완결드라마', '완결무료']",56872,9.83,여성,30대
2371,고인의 명복,"이승과 저승, 삶과 죽음을 둘러싼
한국형 미스터리 판타지","['드라마', '완결드라마']",129205,9.98,여성,30대
2372,그랜드 배틀 토너먼트,지상 최강을 꿈꾸는 자들의 축제가 시작된다,"['액션', '완결액션']",18529,7.26,남성,20대
2373,범상찮은 밤,"현실적인 갈등과 인간관계를 다룬 범상찮은 밤은 깊은 감동을 선사한다. 시대물,  퓨전사극 요소가 더해져 더욱 흥미롭다.","['드라마', '시대물', '퓨전사극', '서스펜스']",56895,9.97,여성,30대
2374,영도의 룸비니,"숨막히는 긴장감과 미스터리로 가득한 영도의 룸비니의 세계. 고자극스릴러,  동양 요소가 더해져 더욱 흥미롭다.","['스릴러', '고자극스릴러', '동양']",56890,9.74,남성,30대
2375,아버지의 컵,"본 콘텐츠는 부산은행의 브랜드웹툰으로 허영만 작가가 전하는
어머니와 아들이 돌아가신 아버지의 유품인 컵과 함께 여행을 하며 느끼는
아버지에 대한 그리움에 대한 이야기 입니다.","['드라마', '완결드라마', '완결무료']",7034,9.86,여성,30대
2376,니편내편,"외로운 인생
사진만 찍으면 누구든 내 편이 된다?!","['드라마', '완결드라마']",185077,9.89,여성,30대
2377,지니의 세포들,"본 컨텐츠는 KT 인공지능TV 기가지니의 브랜드 웹툰입니다.

헤어진 여자친구가 선물해줬다는 이유로 분리수거 위기에 놓인 기가지니!

기영의 새로운 사랑을 위해 애쓰는 인공지능TV 기가지니와 이별의 아픔에서 못벗어나고 있는 기영의 이야기.","['로맨스', '완결로맨스', '완결무료']",15467,9.97,여성,10대
2378,워킹히어로,"괴물로부터 고통받는 도시를 구원하기 위해 괴물보다 더 괴상한 영웅들이 나섰다.

본 컨텐츠는 이상신&국중록 작가가 전하는 한화케미칼의 브랜드 웹툰 입니다.","['완결액션', '히어로', '액션', '완결무료']",17687,9.95,남성,20대
2379,일사부재리,"내가 죽인 그 놈이 살아있다.

SBA-서울문화사-네이버가 함께하는 2014 만화 스카우트 당선작입니다.","['스릴러', '완결스릴러', '완결무료']",25232,9.93,남성,20대
2380,월남특급,"유쾌상쾌통쾌! 지긋지긋한 현실을 벗어나 베트남으로!
돈가방을 들고 튄 두 여자와 악의 무리들의 로얄 어드벤처 베트남 여행기.","['드라마', '완결드라마', '완결무료']",27698,9.87,여성,30대
2381,어둠 속의 닭은 울지 않는다,"소설가 지망생 이정.
어느 날부터 시작된 범죄자들을 타깃으로 한 연쇄 살인이 자신의 글을 바탕으로 일어났음을 알게 된다. 묘한 짜릿함을 느낀 이정은 살인자에게 받은 지령을 토대로 살인 소설을 집필하기 시작한다.","['스릴러', '완결스릴러']",13680,9.67,남성,20대
2382,죽어도 다시 한번!,"예쁜 연인이던 은수와 원오는 3년간의 결혼 생활 후 남보다 못한 원수지간으로 갈라선다.
이혼 후 2년 뒤, 미국에서 사업에 크게 성공한 원오는 한국으로 돌아와 은수와 재회하지만, 은수의 곁은 그녀를 줄곧 짝사랑해온 태인이 지키고 있다.
2년만에 셋이서 재회하게 된 그날 밤, 셋은 같은 와인을 마시고 5년 전 과거로 회귀하게 된다.
은수의 완강한 의지로 은수와 원오는 다시 이혼을 준비하고, 태인은 다시 은수를 빼앗길 수 없다는 불안감에 원오와 대립하게 된다.
하지만 다시 얼굴을 부딪히고 살게 된 은수와 원오는 과거에 몰랐던 서로의 모습들을 알아가며 흔들리는데.","['로맨스', '완결로맨스', '소설원작']",42262,9.92,여성,10대
2383,10년째 차이는 소꿉친구,"고백 받고, 차이는 상황이 일상이 된 소꿉친구 율과 시호. 연인으로 발전할 것인가, 친구로 남을 것인가? 두 사람의 코믹로맨스!","['로맨스', '완결로맨스']",24064,9.94,여성,10대
2384,휴먼천적,"현실적인 갈등과 인간관계를 다룬 휴먼천적은 깊은 감동을 선사한다. 이능력, 액션 요소가 더해져 더욱 흥미롭다.","['드라마', '이능력', '액션', '로맨스']",25289,9.8,남성,20대
2385,언다잉,"전국의 죽어가던 노인들의 병이 한순간에 싹 나았다면?
노인 인구가 급증하고 사회적 비용은 폭발 직전!
졸지에 노인들을 부양하게 된 젊은 사람들 사이에서 노인들이 버림받고 살해당하는 일도 심심찮게 벌어지게 되는데...
죽어가던 사람들이 되살아난 기적인 줄 알았지만 재난인 이야기
죽지않는 노인들, 기적일까 저주일까
불청객이 되어버린 사람들의 이야기가 시작된다.","['스릴러', '완결스릴러']",44379,9.83,남성,20대
2386,흔들리는 세계로부터,"""우리 한번 바꿔보지 않을래?""
동경하던 ‘나’의 입에서 나온 달콤한 제안. 
그리고 바뀐 세계에서 벌어지는 은새의 파란만장 로맨스(?)가 시작된다.","['최강자전', '2021 최강자전', '판타지', '하이틴', '완결판타지']",53638,9.95,남성,10대
2387,나 회춘하다,"평범했던 주인공이 판타지 세계에서 영웅으로 성장하는 나 회춘하다의 이야기. 현대,  고인물 요소가 더해져 더욱 흥미롭다.","['판타지', '액션', '현대', '고인물', '회귀']",42358,8.88,남성,30대
